{
  "name": "skillmaker-marketplace",
  "description": "Skillmaker: Create perfect skills and subagents that use them with isolated context",
  "version": "1.0.0",
  "owner": {
    "name": "Chanho KIM"
  },
  "homepage": "https://github.com/chkim-su/skillmaker",
  "plugins": [
    {
      "name": "skillmaker",
      "source": "./plugins/skillmaker",
      "description": "Create perfect skills and subagents that use them explicitly. Solve the context window problem with skill-based architecture.",
      "version": "1.0.0",
      "author": {
        "name": "Chanho KIM"
      },
      "category": "productivity"
    }
  ]
}
